<?xml version="1.0" encoding="UTF-8"?>
<?xml-stylesheet href="student.xsl" type="text/xsl"?>
<College xmlns:xsi="http://www.w3.org/2001/XMLSchema-instance" xsi:noNamespaceSchemaLocation="student.xsd">
    <Student>
        <id>1</id>
        <Stu-name>Abhi</Stu-name>
        <Stu-Course>MDS</Stu-Course>
        <Stu-Sem>1</Stu-Sem>
        <Stu-Sub1>77</Stu-Sub1>
        <Stu-Sub2>86</Stu-Sub2>
        <Stu-Sub3>75</Stu-Sub3>
        <Stu-Total>238</Stu-Total>
        <Stu-Avg>79.33</Stu-Avg>
    </Student>
    <Student>
        <id>2</id>
        <Stu-name>Rohan</Stu-name>
        <Stu-Course>MCA</Stu-Course>
        <Stu-Sem>2</Stu-Sem>
        <Stu-Sub1>77</Stu-Sub1>
        <Stu-Sub2>86</Stu-Sub2>
        <Stu-Sub3>75</Stu-Sub3>
        <Stu-Total>238</Stu-Total>
        <Stu-Avg>95</Stu-Avg>
    </Student>
</College>